[
  {
    "id": "sg_end_historical",
    "figure": "sample_general",
    "kind": "historical",
    "priority": 1,
    "conditions": {
      "all": {
        "deviated": false
      }
    },
    "cardTitle": "강을 경계로 한 두 나라",
    "text": "당신이 지킨 강은 이후 두 왕조 동안 서련국과 동하국의 국경으로 남는다. 2026년에도 두 나라의 후예는 같은 강을 경계로 삼는다. 변방 성채의 비석에 당신의 이름이 새겨져 있다.",
    "sources": [
      "가상 데이터 — 실제 사료 아님"
    ],
    "map": {
      "regions": [
        {
          "countries": [
            "seoryeon"
          ],
          "label": "서련국",
          "color": "#4a7fb0"
        },
        {
          "countries": [
            "dongha"
          ],
          "label": "동하국",
          "color": "#b0704a"
        }
      ]
    }
  },
  {
    "id": "sg_end_crowned",
    "figure": "sample_general",
    "kind": "alternate",
    "priority": 10,
    "conditions": {
      "all": {
        "deviated": true,
        "crowned_general": true
      }
    },
    "cardTitle": "장군의 왕조",
    "text": "당신의 후손이 서련국의 왕위를 잇는다. 군인이 왕이 되는 전례가 생기고, 이후 왕조 교체는 대부분 군대의 손에서 일어난다. 2026년 서련국 헌법에는 군의 정치 참여를 막는 조항이 따로 있다.",
    "costs": "반대한 대신 가문들이 유배되고 재산을 잃는다. 이후 세 차례의 군사 정변 때마다 수도 주민들이 피해를 입는다.",
    "map": {
      "regions": [
        {
          "countries": [
            "seoryeon"
          ],
          "label": "서련국 (장군 왕조)",
          "color": "#5a6fa8"
        },
        {
          "countries": [
            "dongha"
          ],
          "label": "동하국",
          "color": "#b0704a"
        }
      ]
    }
  },
  {
    "id": "sg_end_new_kingdom",
    "figure": "sample_general",
    "kind": "alternate",
    "priority": 20,
    "conditions": {
      "all": {
        "deviated": true,
        "new_kingdom": true
      }
    },
    "cardTitle": "변방 왕국",
    "text": "당신이 세운 나라는 부족 연합과 변방 성채를 묶어 독자적인 왕국이 된다. 서련국과 변방 왕국은 2026년까지 별개의 나라로 남는다.",
    "costs": "두 나라 사이에 낀 변방 주민들은 한 세대 동안 양쪽에 세금을 낸다. 국경 분쟁이 네 차례 일어난다.",
    "map": {
      "regions": [
        {
          "countries": [
            "seoryeon"
          ],
          "label": "서련국",
          "color": "#4a7fb0"
        },
        {
          "countries": [
            "frontier"
          ],
          "label": "변방 왕국",
          "color": "#6f9a52"
        },
        {
          "countries": [
            "dongha"
          ],
          "label": "동하국",
          "color": "#b0704a"
        }
      ]
    }
  },
  {
    "id": "sg_end_coup",
    "figure": "sample_general",
    "kind": "alternate",
    "priority": 30,
    "conditions": {
      "all": {
        "deviated": true,
        "coup_succeeded": true
      }
    },
    "cardTitle": "재상이 다스리는 나라",
    "text": "정변으로 들어선 재상 정권은 왕실을 의례만 맡는 자리로 만든다. 이후 서련국은 재상이 실권을 쥐는 나라가 된다. 2026년의 서련국 국왕도 의례만 맡는다.",
    "costs": "왕의 측근과 그 가족들이 관직과 재산을 잃는다. 정권에 반대한 지방 귀족들이 숙청된다.",
    "map": {
      "regions": [
        {
          "countries": [
            "seoryeon"
          ],
          "label": "서련국 (재상 정권)",
          "color": "#7a6aa8"
        },
        {
          "countries": [
            "dongha"
          ],
          "label": "동하국",
          "color": "#b0704a"
        }
      ]
    }
  },
  {
    "id": "sg_end_peace",
    "figure": "sample_general",
    "kind": "alternate",
    "priority": 40,
    "conditions": {
      "all": {
        "deviated": true,
        "east_peace": true
      }
    },
    "cardTitle": "동서 교역로",
    "text": "화친 뒤 열린 교역로는 두 나라를 잇는 주요 상업로가 된다. 2026년의 서련국과 동하국은 같은 화폐 동맹에 속해 있다.",
    "costs": "화친의 대가로 넘겨준 국경 성의 주민들은 동하국의 백성이 되거나 고향을 떠나야 한다.",
    "map": {
      "regions": [
        {
          "countries": [
            "seoryeon",
            "dongha"
          ],
          "label": "서련–동하 화폐 동맹",
          "color": "#4a9aa0"
        }
      ]
    }
  },
  {
    "id": "sg_end_long_life",
    "figure": "sample_general",
    "kind": "alternate",
    "priority": 50,
    "conditions": {
      "all": {
        "deviated": true
      },
      "gte": {
        "extraYears": 10
      }
    },
    "cardTitle": "오래 산 장군",
    "text": "당신은 기록보다 오래 살아 서련국 군대의 제도를 정비한다. 당신이 만든 변방 둔전 제도는 이후 수백 년 동안 이어진다. 2026년에도 변방의 지명 몇 곳에 둔전의 이름이 남는다.",
    "costs": "당신이 오래 군권을 쥐는 동안 다음 세대 장수들은 지휘 경험을 쌓지 못한다. 당신이 죽은 뒤 첫 전쟁에서 서련국 군대는 크게 패한다.",
    "map": {
      "regions": [
        {
          "countries": [
            "seoryeon"
          ],
          "label": "서련국",
          "color": "#4a7fb0"
        },
        {
          "countries": [
            "dongha"
          ],
          "label": "동하국",
          "color": "#b0704a"
        }
      ]
    }
  },
  {
    "id": "sg_end_civil_war",
    "figure": "sample_general",
    "kind": "alternate",
    "priority": 55,
    "conditions": {
      "all": {
        "deviated": true,
        "civil_war": true
      }
    },
    "cardTitle": "갈라진 서련국",
    "text": "왕위 계승을 둘러싼 내전은 서련국을 남북으로 나눈다. 두 나라는 2026년에도 서로 다른 왕조를 정통으로 내세운다.",
    "costs": "내전 동안 수도와 곡창 지대가 여러 번 주인을 바꾸고 농민들이 고향을 떠난다.",
    "map": {
      "regions": [
        {
          "countries": [
            "seoryeon_north"
          ],
          "label": "북서련",
          "color": "#4a7fb0"
        },
        {
          "countries": [
            "seoryeon_south"
          ],
          "label": "남서련",
          "color": "#8a9ac0"
        },
        {
          "countries": [
            "dongha"
          ],
          "label": "동하국",
          "color": "#b0704a"
        }
      ]
    }
  },
  {
    "id": "sg_end_capital_fallen",
    "figure": "sample_general",
    "kind": "alternate",
    "priority": 60,
    "conditions": {
      "all": {
        "deviated": true,
        "capital_fallen": true
      }
    },
    "cardTitle": "옮겨 간 수도",
    "text": "재상 일파가 장악한 옛 수도는 끝내 왕실에 돌아오지 않는다. 왕족은 남쪽 도시로 옮겨 새 조정을 세운다. 2026년 서련국의 수도는 기록 속 수도와 다른 도시다.",
    "costs": "옛 수도에 남은 왕실 측근들이 처형되거나 재산을 잃는다. 천도 과정에서 옛 수도의 상인들이 생계를 잃는다.",
    "map": {
      "regions": [
        {
          "countries": [
            "seoryeon"
          ],
          "label": "서련국 (남쪽 천도)",
          "color": "#4a7fb0"
        },
        {
          "countries": [
            "dongha"
          ],
          "label": "동하국",
          "color": "#b0704a"
        }
      ]
    }
  },
  {
    "id": "sg_end_independent",
    "figure": "sample_general",
    "kind": "alternate",
    "priority": 70,
    "conditions": {
      "all": {
        "deviated": true,
        "border_independent": true
      }
    },
    "cardTitle": "자치하는 변방",
    "text": "변방 성채들은 수도의 명령 대신 당신의 명령을 따르는 독자 세력이 된다. 이 세력은 훗날 서련국 안의 자치 지역이 된다. 2026년 지도에서 변방은 서련국과 다른 색으로 칠해진다.",
    "costs": "수도와의 교역이 끊기면서 변방의 곡식 값이 몇 배로 오르고 주민들이 굶주린다.",
    "map": {
      "regions": [
        {
          "countries": [
            "seoryeon"
          ],
          "label": "서련국",
          "color": "#4a7fb0"
        },
        {
          "countries": [
            "frontier"
          ],
          "label": "변방 자치구",
          "color": "#6f9a52"
        },
        {
          "countries": [
            "dongha"
          ],
          "label": "동하국",
          "color": "#b0704a"
        }
      ]
    }
  },
  {
    "id": "sg_end_east_bank_lost",
    "figure": "sample_general",
    "kind": "alternate",
    "priority": 80,
    "conditions": {
      "all": {
        "deviated": true,
        "east_bank_lost": true
      }
    },
    "cardTitle": "강 서쪽의 동하국",
    "text": "강 서쪽의 마을들은 이후 동하국의 영토로 남는다. 2026년의 국경선은 기록보다 서쪽에 그어져 있다.",
    "costs": "새 국경 안에 남은 서련국 주민들은 동하국의 언어와 세금 제도를 따라야 한다.",
    "map": {
      "regions": [
        {
          "countries": [
            "seoryeon"
          ],
          "label": "서련국",
          "color": "#4a7fb0"
        },
        {
          "countries": [
            "dongha",
            "east_bank"
          ],
          "label": "동하국",
          "color": "#b0704a"
        }
      ]
    }
  },
  {
    "id": "sg_end_default",
    "figure": "sample_general",
    "kind": "alternate",
    "priority": 999,
    "isDefault": true,
    "conditions": {
      "all": {
        "deviated": true
      }
    },
    "cardTitle": "조금 다른 서련국",
    "text": "국경선은 기록과 같지만 서련국의 역사는 곳곳에서 달라진다. 2026년 서련국 교과서에 실린 당신의 일대기는 기록과 다른 내용을 담는다.",
    "costs": "기록에서 당신 대신 공을 세웠던 장수와 관리들이 이름을 남기지 못한다.",
    "map": {
      "regions": [
        {
          "countries": [
            "seoryeon"
          ],
          "label": "서련국",
          "color": "#4a7fb0"
        },
        {
          "countries": [
            "dongha"
          ],
          "label": "동하국",
          "color": "#b0704a"
        }
      ]
    }
  }
]
